{
  "source_slug": "interview-lma4p2gdxzm",
  "source_title": "War Prediction, Control, And The Rebellion Of Imagination",
  "source_date": "2026-02-15",
  "source_ref_base": "video:interview-lma4p2gdxzm@transcript:v1",
  "impact_level": "canon-candidate",
  "summary": "This February 15, 2026 Sneako interview joins Iran-war prediction, tech-oligarch surveillance politics, Pax Judaica, child-safety mass-control consent, attention rebellion, and AI-as-Antichrist into one high-pressure bridge between Prediction, Chokepoint, Mass Society, Eschatology, Proximity Games, Attention, and Human Heart.",
  "existing_lens_links": [
    {
      "target": "lens-point:mass-society-surveillance-bargain-grid",
      "episode_phrase": "The tech faction uses public resources, data centers, digital ID, digital currency, AI monitoring, ICE conflict, and Palantir policing to build a surveillance state.",
      "refs": [
        "video:interview-lma4p2gdxzm@transcript:v1#seg-0021",
        "video:interview-lma4p2gdxzm@transcript:v1#seg-0022"
      ],
      "rationale": "The public Mass Society page now carries this source in a durable lens point for the elite-faction and police-normalization layer of the surveillance-bargain grid."
    },
    {
      "target": "lens-point:mass-society-digital-permission-grid",
      "episode_phrase": "Digital ID, digital currency, data centers, online activity monitoring, and AI control appear as the state-backed architecture of a future surveillance order.",
      "refs": [
        "video:interview-lma4p2gdxzm@transcript:v1#seg-0021",
        "video:interview-lma4p2gdxzm@transcript:v1#seg-0065"
      ],
      "rationale": "The source already supports the public digital-permission grid where identity, money, data centers, and AI prediction become population administration."
    }
  ],
  "concept_extensions": [
    {
      "target": "website/src/content/docs/lens/mass-society-as-political-constraint.md",
      "kind": "mechanism",
      "proposed_addition": "Keep this source as the February 2026 factional-surveillance layer before the April domestic-control and May surveillance-bargain sources: tech oligarchs seek state resources for data centers, digital ID, digital currency, online AI monitoring, and ICE/Palantir police-state normalization.",
      "refs": [
        "video:interview-lma4p2gdxzm@transcript:v1#seg-0021",
        "video:interview-lma4p2gdxzm@transcript:v1#seg-0022",
        "video:interview-lma4p2gdxzm@transcript:v1#seg-0065",
        "video:interview-lma4p2gdxzm@transcript:v1#seg-0070",
        "video:interview-lma4p2gdxzm@transcript:v1#seg-0071"
      ],
      "boundary_note": "Mass Society owns this only when the active mechanism is population-scale administration, surveillance, police normalization, or consent through fear. Proximity Games owns the factional street payoff; Attention owns inner dependency; Eschatology owns Antichrist and Pax Judaica role-script language."
    },
    {
      "target": "website/src/content/docs/lens/chokepoint-empire-and-no-exit-war.md",
      "kind": "mechanism",
      "proposed_addition": "Use the Iran passages as early 2026 no-exit pressure: Jiang says an Iran war would expose U.S. manufacturing limits, draft problems, morale failure, logistics, Iran's terrain, and Russian/Chinese stakes.",
      "refs": [
        "video:interview-lma4p2gdxzm@transcript:v1#seg-0031",
        "video:interview-lma4p2gdxzm@transcript:v1#seg-0033",
        "video:interview-lma4p2gdxzm@transcript:v1#seg-0034",
        "video:interview-lma4p2gdxzm@transcript:v1#seg-0037",
        "video:interview-lma4p2gdxzm@transcript:v1#seg-0039"
      ],
      "boundary_note": "Chokepoint owns material war limits, route exposure, and no-exit escalation. Prediction owns dated forecast comparison and later miss/revision testing."
    },
    {
      "target": "website/src/content/docs/lens/eschatology.md",
      "kind": "mechanism",
      "proposed_addition": "Hold the Pax Judaica, AI Antichrist, and Iran/end-times material for a bounded Eschatology pass after comparison with other January-March 2026 sources.",
      "refs": [
        "video:interview-lma4p2gdxzm@transcript:v1#seg-0065",
        "video:interview-lma4p2gdxzm@transcript:v1#seg-0094",
        "video:interview-lma4p2gdxzm@transcript:v1#seg-0095",
        "video:interview-lma4p2gdxzm@transcript:v1#seg-0243",
        "video:interview-lma4p2gdxzm@transcript:v1#seg-0245"
      ],
      "boundary_note": "Eschatology owns role-script and Antichrist language. Mass Society owns the same AI system only when the active mechanism is administrative population control."
    },
    {
      "target": "website/src/content/docs/lens/attention-capture-as-capital-extraction.md",
      "kind": "mechanism",
      "proposed_addition": "Use the reading and AI-dependence sections as attention evidence: Jiang frames disciplined reading as rebellion and says the AI surveillance state aims to make people dependent on machine mediation.",
      "refs": [
        "video:interview-lma4p2gdxzm@transcript:v1#seg-0199",
        "video:interview-lma4p2gdxzm@transcript:v1#seg-0205",
        "video:interview-lma4p2gdxzm@transcript:v1#seg-0241",
        "video:interview-lma4p2gdxzm@transcript:v1#seg-0245",
        "video:interview-lma4p2gdxzm@transcript:v1#seg-0247"
      ],
      "boundary_note": "Attention owns focus, dependency, reading, and machine mediation inside the person. Mass Society owns the outer administrative grid."
    },
    {
      "target": "website/src/content/docs/lens/human-heart-as-civilizational-measure.md",
      "kind": "evidence",
      "proposed_addition": "Use the closing sections as support for love, imagination, teaching, children, and cooperation as Jiang's counterweight to surveillance civilization.",
      "refs": [
        "video:interview-lma4p2gdxzm@transcript:v1#seg-0214",
        "video:interview-lma4p2gdxzm@transcript:v1#seg-0215",
        "video:interview-lma4p2gdxzm@transcript:v1#seg-0231",
        "video:interview-lma4p2gdxzm@transcript:v1#seg-0238",
        "video:interview-lma4p2gdxzm@transcript:v1#seg-0254"
      ],
      "boundary_note": "Human Heart owns relation, love, cooperative resilience, teaching, and purpose. Free Will may receive the agency side, but this source's closing pressure is relational and imaginative."
    }
  ],
  "new_lens_seeds": [
    {
      "slug": "child-safety-converts-control-consent",
      "title": "Child Safety Converts Control Consent",
      "core_mechanism": "Fear for children can convert a population toward microchips, digital ID, tracking, and mass surveillance by making the control grid feel like protection rather than domination.",
      "why_reusable": "The mechanism recurs across child-safety digital ID, microchipping, Epstein-file fear, missing-child panic, and future emergency-control passages, but it should remain a held seed until compared with other child-safety and family-fear sources.",
      "touches_existing_concepts": [
        "mass-society-constraint",
        "attention-capture",
        "bureaucracy",
        "human-heart"
      ],
      "refs": [
        "video:interview-lma4p2gdxzm@transcript:v1#seg-0065",
        "video:interview-lma4p2gdxzm@transcript:v1#seg-0066",
        "video:interview-lma4p2gdxzm@transcript:v1#seg-0067",
        "video:interview-lma4p2gdxzm@transcript:v1#seg-0070"
      ],
      "public_now": false
    }
  ],
  "atlas_mutations": [],
  "chronology_notes": [
    {
      "note": "This February 15, 2026 interview is earlier than the April 2026 domestic-control-grid cluster and the May 18 surveillance-bargain interview, so it should be treated as a prior factional formulation: tech oligarchs want state resources for the AI surveillance state before Jiang later casts the same grid as domestic war administration and global bargain.",
      "refs": [
        "video:interview-lma4p2gdxzm@transcript:v1#seg-0021",
        "video:predictive-history-ts-aa6lqf6i@transcript:v1#seg-0054",
        "video:interview-61z1rb3uvpc@transcript:v1#seg-0069",
        "video:interview-izzvijq0gka@transcript:v1#seg-0089"
      ]
    }
  ],
  "canon_candidates": [
    {
      "kind": "prediction-ledger-candidate",
      "candidate": "Jiang's February 15, 2026 Iran-war claims should be compared with the March 2026 no-exit/draft/emergency-power cluster before ledger promotion.",
      "refs": [
        "video:interview-lma4p2gdxzm@transcript:v1#seg-0031",
        "video:interview-lma4p2gdxzm@transcript:v1#seg-0033",
        "video:interview-lma4p2gdxzm@transcript:v1#seg-0039"
      ],
      "promotion_route": "Prediction ledger only after later-source and public-event comparison; Chokepoint owns the material war diagnosis."
    }
  ],
  "next_actions": [
    "Request Dante review for the Mass Society public mutation that now promotes this source into lens-point:mass-society-surveillance-bargain-grid.",
    "Compare the held child-safety consent seed against January 24 digital-ID child-safety material before deciding whether it belongs as a Mass Society subsection or remains folded into the digital permission grid.",
    "Use this source in a future Eschatology boundary pass only with speculation caveats; do not let Pax Judaica or AI Antichrist claims become generic Mass Society prose."
  ]
}
